{
  "$schema": "https://json-schema.org/draft/2020-12/schema",
  "$id": "https://raw.githubusercontent.com/sheplu/space-engineer-2-base-game/main/schemas/envelope.schema.json",
  "title": "SE2 Dataset Envelope",
  "description": "Shared wrapper for every dataset file in this repo. `resources` is defined as a non-empty array but the per-record shape is validated by one of the record schemas (resource-raw, resource-item, resource-block).",
  "type": "object",
  "required": ["version", "generatedAt", "game", "resources"],
  "properties": {
    "version": {
      "type": "string",
      "pattern": "^\\d+\\.\\d+\\.\\d+$",
      "description": "Semver of the dataset schema/contents. Bump on content changes."
    },
    "generatedAt": {
      "type": "string",
      "format": "date",
      "description": "ISO date (YYYY-MM-DD) this file was last updated."
    },
    "game": {
      "type": "object",
      "required": ["name", "stage", "dataAsOf"],
      "properties": {
        "name": { "type": "string" },
        "stage": { "type": "string" },
        "dataAsOf": { "type": "string", "format": "date" }
      }
    },
    "sources": {
      "type": "array",
      "items": { "type": "string", "format": "uri" },
      "description": "Upstream wiki/reference URLs the dataset was compiled from."
    },
    "notes": {
      "type": "string",
      "description": "Free-form notes about the dataset's scope, caveats, anomalies."
    },
    "resources": {
      "type": "array",
      "minItems": 1,
      "items": { "type": "object" }
    }
  }
}
