{
  "version": "1.0.0",
  "generatedAt": "2026-04-26",
  "game": {
    "name": "Space Engineers 2",
    "stage": "Early Access",
    "dataAsOf": "2026-04-26"
  },
  "sources": [
    "https://spaceengineers2.wiki.gg/wiki/Category:Utility"
  ],
  "notes": "Station terminals: Contract Terminal (mission kiosk placed by the Colonization Authority) and Trade Terminal (commerce kiosk on stations across the Almagest). Both blocks are present in the world but 'cannot be unlocked in survival' — players don't craft them; they interact with them. Their inventory reports the int64 max (9,223,372,036,854,775,807 kg) which is a code sentinel for 'unlimited' rather than a real capacity — stored as unlimited=true with a raw value for completeness.",
  "resources": [
    {
      "id": "contract_terminal_2_5_m",
      "displayName": "Contract Terminal 2.5 m",
      "type": "block",
      "subcategory": "terminals",
      "terminalRole": "contract",
      "size_m": 2.5,
      "mass_kg": 753.56,
      "health": 602.84,
      "pcu": 60,
      "snapSize": 10,
      "description": "A station terminal used by the Colonization Authority to issue contracts to engineers as part of Colonization. Features an interactable screen, keyboard, and reward hatch; large conveyor port on the rear.",
      "gameStatus": "active",
      "buildComponents": [
        { "id": "steel_plate", "qty": 22 }
      ],
      "power": { "maxInput": null, "unitAsPublished": null },
      "terminal": { "function": "issues mission contracts; interactive map markers and tooltips" },
      "inventory": { "unlimited": true, "maxMass_kg_raw": 9223372036854775807 },
      "unlock": "Cannot be unlocked in survival (interacted with on stations, not player-built)",
      "wiki": "https://spaceengineers2.wiki.gg/wiki/Contract_Terminal_2.5_m",
      "dataGaps": ["power.maxInput (not published)"]
    },
    {
      "id": "trade_terminal_2_5_m",
      "displayName": "Trade Terminal 2.5 m",
      "type": "block",
      "subcategory": "terminals",
      "terminalRole": "trade",
      "size_m": 2.5,
      "mass_kg": 785.9,
      "health": 628.72,
      "pcu": 40,
      "snapSize": 10,
      "description": "Allows trading on stations across the Almagest system.",
      "gameStatus": "active",
      "buildComponents": [
        { "id": "steel_plate", "qty": 22 }
      ],
      "power": { "maxInput": 0, "unitAsPublished": null },
      "terminal": { "function": "commerce transactions at stations" },
      "inventory": { "unlimited": true, "maxMass_kg_raw": 9223372036854775807 },
      "unlock": "Cannot be unlocked in survival (interacted with on stations, not player-built)",
      "wiki": "https://spaceengineers2.wiki.gg/wiki/Trade_Terminal_2.5_m",
      "dataGaps": ["power.maxInput (wiki reports 0, likely an oversight — the block clearly requires power to show screens)"]
    }
  ]
}
