{
  "version": "1.0.0",
  "generatedAt": "2026-04-26",
  "game": {
    "name": "Space Engineers 2",
    "stage": "Early Access",
    "dataAsOf": "2026-04-26"
  },
  "sources": [
    "https://spaceengineers2.wiki.gg/wiki/Category:Utility"
  ],
  "notes": "Door blocks. SE2 Early Access currently has a single door variant — a compact sliding door. If pressurized/airlock/wide door variants are added later, they belong here. Build-component quantities are totals (initial + extra welding phases). Power.maxInput is reported as 0 on the wiki — almost certainly an oversight since doors have motors.",
  "resources": [
    {
      "id": "narrow_sliding_door_2_5_m",
      "displayName": "Narrow Sliding Door 2.5 m",
      "type": "block",
      "subcategory": "doors",
      "doorRole": "sliding",
      "size_m": 2.5,
      "mass_kg": 655.83,
      "health": 524.66,
      "pcu": 200,
      "snapSize": 2,
      "description": "A compact door that slides open.",
      "gameStatus": "active",
      "buildComponents": [
        { "id": "steel_plate", "qty": 14 },
        { "id": "electronic_parts", "qty": 2 },
        { "id": "motor", "qty": 4 }
      ],
      "power": { "maxInput": 0, "unitAsPublished": null },
      "door": { "pressurized": null, "openTimeSeconds": null },
      "unlock": "Unlocked by default in all survival worlds",
      "wiki": "https://spaceengineers2.wiki.gg/wiki/Narrow_Sliding_Door_2.5_m",
      "dataGaps": ["power.maxInput (wiki reports 0, likely an oversight)", "door.openTimeSeconds", "door.pressurized (unclear whether the door seals atmosphere)"]
    }
  ]
}
