{
  "version": "1.0.0",
  "generatedAt": "2026-04-27",
  "game": {
    "name": "Space Engineers 2",
    "stage": "Early Access",
    "dataAsOf": "2026-04-27"
  },
  "sources": [
    "https://spaceengineers2.wiki.gg/wiki/Category:Interior_Wall"
  ],
  "notes": "Interior wall blocks — solid partitions used to divide ship/station interiors into rooms. 9 entries: 4 flat-ish shapes (Flat, Flat Half, Corner, Corner with Side) and 4 pillar variants (Pillar Flat, Pillar Slope, Pillar Curved Thick, Pillar Curved Thin), all 2.5 m, plus one planned stub (Interior Wall Pillar — family overview page with no infobox yet). All built from Steel Plate only; health == mass. `wallShape` captures the geometry variant.",
  "resources": [
    {
      "id": "interior_wall_flat_2_5_m",
      "displayName": "Interior Wall Flat 2.5 m",
      "type": "block",
      "subcategory": "interior_walls",
      "wallShape": "flat",
      "size_m": 2.5,
      "mass_kg": 225,
      "health": 225,
      "pcu": 5,
      "snapSize": 1,
      "description": "Used for partitioning areas on grids and creating rooms.",
      "gameStatus": "active",
      "buildComponents": [
        { "id": "steel_plate", "qty": 6 }
      ],
      "unlock": "Unlocked by default in all survival worlds",
      "wiki": "https://spaceengineers2.wiki.gg/wiki/Interior_Wall_Flat_2.5_m",
      "dataGaps": []
    },
    {
      "id": "interior_wall_flat_half_2_5_m",
      "displayName": "Interior Wall Flat Half 2.5 m",
      "type": "block",
      "subcategory": "interior_walls",
      "wallShape": "flat_half",
      "size_m": 2.5,
      "mass_kg": 137.15,
      "health": 137.15,
      "pcu": 5,
      "snapSize": 1,
      "description": "Used for partitioning areas on grids and creating rooms.",
      "gameStatus": "active",
      "buildComponents": [
        { "id": "steel_plate", "qty": 4 }
      ],
      "unlock": "Unlocked by default in all survival worlds",
      "wiki": "https://spaceengineers2.wiki.gg/wiki/Interior_Wall_Flat_Half_2.5_m",
      "dataGaps": []
    },
    {
      "id": "interior_wall_corner_2_5_m",
      "displayName": "Interior Wall Corner 2.5 m",
      "type": "block",
      "subcategory": "interior_walls",
      "wallShape": "corner",
      "size_m": 2.5,
      "mass_kg": 350.51,
      "health": 350.51,
      "pcu": 5,
      "snapSize": 10,
      "description": "Used for partitioning areas on grids and creating rooms.",
      "gameStatus": "active",
      "buildComponents": [
        { "id": "steel_plate", "qty": 10 }
      ],
      "unlock": "Unlocked by default in all survival worlds",
      "wiki": "https://spaceengineers2.wiki.gg/wiki/Interior_Wall_Corner_2.5_m",
      "dataGaps": []
    },
    {
      "id": "interior_wall_corner_with_side_2_5_m",
      "displayName": "Interior Wall Corner with Side 2.5 m",
      "type": "block",
      "subcategory": "interior_walls",
      "wallShape": "corner_with_side",
      "size_m": 2.5,
      "mass_kg": 445.57,
      "health": 445.57,
      "pcu": 5,
      "snapSize": 10,
      "description": "Used for partitioning areas on grids and creating rooms.",
      "gameStatus": "active",
      "buildComponents": [
        { "id": "steel_plate", "qty": 13 }
      ],
      "unlock": "Unlocked by default in all survival worlds",
      "wiki": "https://spaceengineers2.wiki.gg/wiki/Interior_Wall_Corner_with_Side_2.5_m",
      "dataGaps": []
    },
    {
      "id": "interior_wall_pillar_flat_2_5_m",
      "displayName": "Interior Wall Pillar Flat 2.5 m",
      "type": "block",
      "subcategory": "interior_walls",
      "wallShape": "pillar_flat",
      "size_m": 2.5,
      "mass_kg": 39.79,
      "health": 39.79,
      "pcu": 5,
      "snapSize": 1,
      "description": "Used for partitioning areas on grids and creating rooms — pillar variant.",
      "gameStatus": "active",
      "buildComponents": [
        { "id": "steel_plate", "qty": 1 }
      ],
      "unlock": "Unlocked by default in all survival worlds",
      "wiki": "https://spaceengineers2.wiki.gg/wiki/Interior_Wall_Pillar_Flat_2.5_m",
      "dataGaps": []
    },
    {
      "id": "interior_wall_pillar_slope_2_5_m",
      "displayName": "Interior Wall Pillar Slope 2.5 m",
      "type": "block",
      "subcategory": "interior_walls",
      "wallShape": "pillar_slope",
      "size_m": 2.5,
      "mass_kg": 39.79,
      "health": 39.79,
      "pcu": 5,
      "snapSize": 1,
      "description": "Used for partitioning areas on grids and creating rooms — pillar variant.",
      "gameStatus": "active",
      "buildComponents": [
        { "id": "steel_plate", "qty": 1 }
      ],
      "unlock": "Unlocked by default in all survival worlds",
      "wiki": "https://spaceengineers2.wiki.gg/wiki/Interior_Wall_Pillar_Slope_2.5_m",
      "dataGaps": []
    },
    {
      "id": "interior_wall_pillar_curved_thick_2_5_m",
      "displayName": "Interior Wall Pillar Curved Thick 2.5 m",
      "type": "block",
      "subcategory": "interior_walls",
      "wallShape": "pillar_curved_thick",
      "size_m": 2.5,
      "mass_kg": 311.68,
      "health": 311.68,
      "pcu": 5,
      "snapSize": 2,
      "description": "Used for partitioning areas on grids and creating rooms — curved pillar variant.",
      "gameStatus": "active",
      "buildComponents": [
        { "id": "steel_plate", "qty": 9 }
      ],
      "unlock": "Unlocked by default in all survival worlds",
      "wiki": "https://spaceengineers2.wiki.gg/wiki/Interior_Wall_Pillar_Curved_Thick_2.5_m",
      "dataGaps": []
    },
    {
      "id": "interior_wall_pillar_curved_thin_2_5_m",
      "displayName": "Interior Wall Pillar Curved Thin 2.5 m",
      "type": "block",
      "subcategory": "interior_walls",
      "wallShape": "pillar_curved_thin",
      "size_m": 2.5,
      "mass_kg": 116.46,
      "health": 116.46,
      "pcu": 5,
      "snapSize": 2,
      "description": "Used for partitioning areas on grids and creating rooms — curved pillar variant.",
      "gameStatus": "active",
      "buildComponents": [
        { "id": "steel_plate", "qty": 3 }
      ],
      "unlock": "Unlocked by default in all survival worlds",
      "wiki": "https://spaceengineers2.wiki.gg/wiki/Interior_Wall_Pillar_Curved_Thin_2.5_m",
      "dataGaps": []
    },
    {
      "id": "interior_wall_pillar",
      "displayName": "Interior Wall Pillar",
      "type": "block",
      "subcategory": "interior_walls",
      "wallShape": null,
      "size_m": null,
      "mass_kg": null,
      "health": null,
      "pcu": null,
      "snapSize": null,
      "description": "A structural block for decoration and visual support in gravity environments. Overview/family page listing four pillar variants — wiki flags it as Creative-mode only with no infobox yet.",
      "gameStatus": "planned",
      "buildComponents": [],
      "unlock": null,
      "wiki": "https://spaceengineers2.wiki.gg/wiki/Interior_Wall_Pillar",
      "dataGaps": ["size_m", "mass_kg", "health", "pcu", "snapSize", "buildComponents (wiki marks this as Creative-mode only, no recipe yet)", "unlock"]
    }
  ]
}
