{
  "version": "1.0.0",
  "generatedAt": "2026-04-26",
  "game": {
    "name": "Space Engineers 2",
    "stage": "Early Access",
    "dataAsOf": "2026-04-26"
  },
  "sources": [
    "https://spaceengineers2.wiki.gg/wiki/Category:Utility"
  ],
  "notes": "Life-support blocks — revive, heal, and refuel the player when powered and activated (hold F). Survival Kit 2.5 m is the starter respawn point; Medical Room 5 m is the late-game upgrade with higher restoration rates. The generic 'Survival Kit' wiki page is a disambiguation/overview stub with no numeric stats — modeled with gameStatus='planned' until a specific sized variant is published. Every entry reports power.maxInput=0 on the wiki; almost certainly a wiki omission (the blocks explicitly require power to function). Restoration rates are per-second while activated.",
  "resources": [
    {
      "id": "survival_kit_2_5_m",
      "displayName": "Survival Kit 2.5 m",
      "type": "block",
      "subcategory": "life_support",
      "lifeSupportRole": "survival_kit",
      "size_m": 2.5,
      "mass_kg": 975.05,
      "health": 780.04,
      "pcu": 50,
      "snapSize": 2,
      "description": "Allows Space Engineers to be revived and heal when powered and activated. The starter respawn/life-support block.",
      "gameStatus": "active",
      "buildComponents": [
        { "id": "steel_plate", "qty": 21 },
        { "id": "electronic_parts", "qty": 3 },
        { "id": "motor", "qty": 6 }
      ],
      "power": { "maxInput": 0, "unitAsPublished": null },
      "restoration": {
        "healthPerSec": 12.5,
        "hydrogenPerSec": 12.5,
        "oxygenPerSec": 12.5,
        "energyPerSec": 50,
        "activation": "hold F while powered",
        "respawnPoint": true
      },
      "unlock": "Unlocked by default in all survival worlds",
      "wiki": "https://spaceengineers2.wiki.gg/wiki/Survival_Kit_2.5_m",
      "dataGaps": ["power.maxInput (wiki reports 0, likely an oversight)", "inventory (not published)"]
    },
    {
      "id": "medical_room_5_m",
      "displayName": "Medical Room 5 m",
      "type": "block",
      "subcategory": "life_support",
      "lifeSupportRole": "medical_room",
      "size_m": 5,
      "mass_kg": 3368.7,
      "health": 2694.96,
      "pcu": 50,
      "snapSize": 10,
      "description": "Allows Space Engineers to be revived and heal when powered and activated, critical for survival. Higher restoration rates than the Survival Kit.",
      "gameStatus": "active",
      "buildComponents": [
        { "id": "steel_plate", "qty": 56 },
        { "id": "compressor", "qty": 20 },
        { "id": "motherboard", "qty": 2 },
        { "id": "chemical_synthesizer", "qty": 2 }
      ],
      "power": { "maxInput": 0, "unitAsPublished": null },
      "restoration": {
        "healthPerSec": 25,
        "hydrogenPerSec": 25,
        "oxygenPerSec": 25,
        "energyPerSec": 90,
        "activation": "hold F while powered",
        "respawnPoint": true
      },
      "unlock": "Kemik sector, 38% contract progress",
      "wiki": "https://spaceengineers2.wiki.gg/wiki/Medical_Room_5_m",
      "dataGaps": ["power.maxInput (wiki reports 0, likely an oversight)", "inventory (not published)"]
    },
    {
      "id": "survival_kit_generic",
      "displayName": "Survival Kit",
      "type": "block",
      "subcategory": "life_support",
      "lifeSupportRole": "survival_kit",
      "size_m": null,
      "mass_kg": null,
      "health": null,
      "pcu": null,
      "snapSize": null,
      "description": "Utility block that heals, recharges, and refuels when powered. Hold F to activate. Can be registered as one of two possible respawn points. Has conveyors on top and bottom and two small ports on the sides; the front requires accessibility for screen interaction.",
      "gameStatus": "planned",
      "buildComponents": [],
      "power": { "maxInput": null, "unitAsPublished": null },
      "restoration": { "activation": "hold F while powered", "respawnPoint": true },
      "unlock": null,
      "wiki": "https://spaceengineers2.wiki.gg/wiki/Survival_Kit",
      "dataGaps": ["size_m", "mass_kg", "health", "pcu", "snapSize", "buildComponents", "power.maxInput", "restoration.healthPerSec / hydrogenPerSec / oxygenPerSec / energyPerSec", "unlock", "wiki page is a generic overview without numeric specs (modeled as 'planned' until a specific sized variant is documented)"]
    }
  ]
}
